"Bill_id","Bill_description","Patron_id","Patron_name","Last_house_committee_id","Last_house_action","Last_house_action_date","Last_senate_committee_id","Last_senate_action","Last_senate_action_date","Last_conference_action","Last_conference_action_date","Last_governor_action","Last_governor_action_date","Emergency","Passed_house","Passed_senate","Passed","Failed","Carried_over","Approved","Vetoed","Full_text_doc1","Full_text_date1","Full_text_doc2","Full_text_date2","Full_text_doc3","Full_text_date3","Full_text_doc4","Full_text_date4","Full_text_doc5","Full_text_date5","Full_text_doc6","Full_text_date6","Last_house_actid","Last_senate_actid","Last_conference_actid","Last_governor_actid","Chapter_id","Introduction_date","Last_actid"
"HB901","Substantial risk orders; eligible petitioners; substantial risk factors and considerations; court jurisdiction; constructive possession of firearms; penalty. ","H0269","Sullivan","","Committee Referral Pending","1/13/2026","","","","","","","","N","N","N","N","N","N","N","N","HB901","1/13/2026","","","","","","","","","","","H2201","","","","","1/13/2026","H2201"
"HB902","Financial institutions; out-of-state credit unions.","H0239","Lopez","","Committee Referral Pending","1/13/2026","","","","","","","","N","N","N","N","N","N","N","N","HB902","1/13/2026","","","","","","","","","","","H2201","","","","","1/13/2026","H2201"
"HB903","Electric utilities; performance-based regulation, work group; report.","H0269","Sullivan","","Committee Referral Pending","1/13/2026","","","","","","","","N","N","N","N","N","N","N","N","HB903","1/13/2026","","","","","","","","","","","H2201","","","","","1/13/2026","H2201"
"HB904","Department of Housing and Community Development; Virginia Disaster Assistance Fund; post-disaster recovery; floodplain mitigation and resilience projects. ","H0239","Lopez","","Committee Referral Pending","1/13/2026","","","","","","","","N","N","N","N","N","N","N","N","HB904","1/13/2026","","","","","","","","","","","H2201","","","","","1/13/2026","H2201"
"HB905","Persons other than ministers who may perform rites of marriage; clerk; issuance of order; bond requirement.","H0239","Lopez","","Committee Referral Pending","1/13/2026","","","","","","","","N","N","N","N","N","N","N","N","HB905","1/13/2026","","","","","","","","","","","H2201","","","","","1/13/2026","H2201"
"HB906","State Corporation Commission; work group; energy load flexibility protocols; high electric demand customers; report. ","H0269","Sullivan","","Committee Referral Pending","1/13/2026","","","","","","","","N","N","N","N","N","N","N","N","HB906","1/13/2026","","","","","","","","","","","H2201","","","","","1/13/2026","H2201"
"HB907","Security requirements for dealers in firearms; civil penalty. ","H0344","Shin","","Committee Referral Pending","1/13/2026","","","","","","","","N","N","N","N","N","N","N","N","HB907","1/13/2026","","","","","","","","","","","H2201","","","","","1/13/2026","H2201"
"HB908","Towing advisory boards; membership.","H0239","Lopez","","Committee Referral Pending","1/13/2026","","","","","","","","N","N","N","N","N","N","N","N","HB908","1/13/2026","","","","","","","","","","","H2201","","","","","1/13/2026","H2201"
"HB909","Elections administration; certain activities or conduct prohibited at polling places applicable to locations for absentee voting in person; prohibited possession of firearm within 100 feet of certain locations. ","H0344","Shin","","Committee Referral Pending","1/13/2026","","","","","","","","N","N","N","N","N","N","N","N","HB909","1/13/2026","","","","","","","","","","","H2201","","","","","1/13/2026","H2201"
"HB910","Prohibited acquisition of single family homes; affidavit; civil penalty. ","H0344","Shin","","Committee Referral Pending","1/13/2026","","","","","","","","N","N","N","N","N","N","N","N","HB910","1/13/2026","","","","","","","","","","","H2201","","","","","1/13/2026","H2201"
"HB911","Limited-duration licenses, driver privilege cards and permits, etc.; expiration.","H0239","Lopez","","Committee Referral Pending","1/13/2026","","","","","","","","N","N","N","N","N","N","N","N","HB911","1/13/2026","","","","","","","","","","","H2201","","","","","1/13/2026","H2201"
"HB912","Public schools; right to free public elementary and secondary education; discrimination based on immigration status prohibited; requirements; civil cause of action. ","H0239","Lopez","","Committee Referral Pending","1/13/2026","","","","","","","","N","N","N","N","N","N","N","N","HB912","1/13/2026","","","","","","","","","","","H2201","","","","","1/13/2026","H2201"
"HB913","Superintendent of Public Instruction; reverse certain recent actions and restore certain rescinded resources. ","H0239","Lopez","","Committee Referral Pending","1/13/2026","","","","","","","","N","N","N","N","N","N","N","N","HB913","1/13/2026","","","","","","","","","","","H2201","","","","","1/13/2026","H2201"
"HB914","Local Environmental Impact Fund.","H0239","Lopez","","Committee Referral Pending","1/13/2026","","","","","","","","N","N","N","N","N","N","N","N","HB914","1/13/2026","","","","","","","","","","","H2201","","","","","1/13/2026","H2201"
"HB915","Local taxation; tax extension for federal government shutdown. ","H0239","Lopez","","Committee Referral Pending","1/13/2026","","","","","","","","N","N","N","N","N","N","N","N","HB915","1/13/2026","","","","","","","","","","","H2201","","","","","1/13/2026","H2201"
"HB916","Concealed handgun permit; demonstrated competence.","H0239","Lopez","","Committee Referral Pending","1/13/2026","","","","","","","","N","N","N","N","N","N","N","N","HB916","1/13/2026","","","","","","","","","","","H2201","","","","","1/13/2026","H2201"
"HB917","Board of Pharmacy; compounding pharmacies; use of bulk drug substances; recordkeeping.","H0327","Willett","","Committee Referral Pending","1/13/2026","","","","","","","","N","N","N","N","N","N","N","N","HB917","1/13/2026","","","","","","","","","","","H2201","","","","","1/13/2026","H2201"
"HB918","Virginia Clean Energy Research and Support Center; established. ","H0269","Sullivan","","Committee Referral Pending","1/13/2026","","","","","","","","N","N","N","N","N","N","N","N","HB918","1/13/2026","","","","","","","","","","","H2201","","","","","1/13/2026","H2201"
"HB919","Retail sales and use tax; firearm and ammunition tax. ","H0239","Lopez","","Committee Referral Pending","1/13/2026","","","","","","","","N","N","N","N","N","N","N","N","HB919","1/13/2026","","","","","","","","","","","H2201","","","","","1/13/2026","H2201"
"HB920","Electric utilities; development of offshore wind capacity. ","H0239","Lopez","","Committee Referral Pending","1/13/2026","","","","","","","","N","N","N","N","N","N","N","N","HB920","1/13/2026","","","","","","","","","","","H2201","","","","","1/13/2026","H2201"
"HB921","Electric utilities; licensed retail suppliers; renewable portfolio standard requirements. ","H0239","Lopez","","Committee Referral Pending","1/13/2026","","","","","","","","N","N","N","N","N","N","N","N","HB921","1/13/2026","","","","","","","","","","","H2201","","","","","1/13/2026","H2201"
"HB922","County manager plan of government; affordable dwelling unit ordinance.","H0239","Lopez","","Committee Referral Pending","1/13/2026","","","","","","","","N","N","N","N","N","N","N","N","HB922","1/13/2026","","","","","","","","","","","H2201","","","","","1/13/2026","H2201"
"HB923","Protection of employees; stay or pay contracts prohibited; civil penalty.","H0239","Lopez","","Committee Referral Pending","1/13/2026","","","","","","","","N","N","N","N","N","N","N","N","HB923","1/13/2026","","","","","","","","","","","H2201","","","","","1/13/2026","H2201"
"HB924","Board of Education and Superintendent of Public Instruction; state program to support the improvement of low-performing schools. ","H0266","Rasoul","","Committee Referral Pending","1/13/2026","","","","","","","","N","N","N","N","N","N","N","N","HB924","1/13/2026","","","","","","","","","","","H2201","","","","","1/13/2026","H2201"
"HB925","Virginia Human Rights Act; unlawful discriminatory practices; civil actions; statute of limitations.","H0239","Lopez","","Committee Referral Pending","1/13/2026","","","","","","","","N","N","N","N","N","N","N","N","HB925","1/13/2026","","","","","","","","","","","H2201","","","","","1/13/2026","H2201"
"HB926","Prohibition on outdoor shooting of firearm on property without reasonable care; penalty.","H0239","Lopez","","Committee Referral Pending","1/13/2026","","","","","","","","N","N","N","N","N","N","N","N","HB926","1/13/2026","","","","","","","","","","","H2201","","","","","1/13/2026","H2201"
"HB927","Human trafficking digital identification and reporting platforms; duties of Human Trafficking Response Coordinator; quarterly reports. ","H0345","Tata","","Committee Referral Pending","1/13/2026","","","","","","","","N","N","N","N","N","N","N","N","HB927","1/13/2026","","","","","","","","","","","H2201","","","","","1/13/2026","H2201"
"HB928","Electric utilities; small portable solar generation devices; local regulation; Residential Landlord and Tenant Act.","H0239","Lopez","","Committee Referral Pending","1/13/2026","","","","","","","","N","N","N","N","N","N","N","N","HB928","1/13/2026","","","","","","","","","","","H2201","","","","","1/13/2026","H2201"
"HB929","Uniform Power of Attorney Act; acknowledged power of attorney; definition.","H0264","Simon","","Committee Referral Pending","1/13/2026","","","","","","","","N","N","N","N","N","N","N","N","HB929","1/13/2026","","","","","","","","","","","H2201","","","","","1/13/2026","H2201"
"HB930","Protection of employees; retaliatory action against employee prohibited.","H0264","Simon","","Committee Referral Pending","1/13/2026","","","","","","","","N","N","N","N","N","N","N","N","HB930","1/13/2026","","","","","","","","","","","H2201","","","","","1/13/2026","H2201"
"HB931","Recovery residences; regulations.","H0264","Simon","","Committee Referral Pending","1/13/2026","","","","","","","","N","N","N","N","N","N","N","N","HB931","1/13/2026","","","","","","","","","","","H2201","","","","","1/13/2026","H2201"
"HB932","Revision of Title 30.","H0264","Simon","","Committee Referral Pending","1/13/2026","","","","","","","","N","N","N","N","N","N","N","N","HB932","1/13/2026","","","","","","","","","","","H2201","","","","","1/13/2026","H2201"
"HB933","Penalties for failure to appear; contempt.","H0264","Simon","","Committee Referral Pending","1/13/2026","","","","","","","","N","N","N","N","N","N","N","N","HB933","1/13/2026","","","","","","","","","","","H2201","","","","","1/13/2026","H2201"
"HB934","Alcoholic beverage control; government stores; distiller's licensees as agents of the Board; sale of alcoholic beverages.","H0264","Simon","","Committee Referral Pending","1/13/2026","","","","","","","","N","N","N","N","N","N","N","N","HB934","1/13/2026","","","","","","","","","","","H2201","","","","","1/13/2026","H2201"
"HB935","Virginia Clean Energy and Battery Storage Promotion Program established; report. ","H0239","Lopez","","Committee Referral Pending","1/13/2026","","","","","","","","N","N","N","N","N","N","N","N","HB935","1/13/2026","","","","","","","","","","","H2201","","","","","1/13/2026","H2201"
"HB936","Enforcement of parking violations; certain counties; pilot program.","H0239","Lopez","","Committee Referral Pending","1/13/2026","","","","","","","","N","N","N","N","N","N","N","N","HB936","1/13/2026","","","","","","","","","","","H2201","","","","","1/13/2026","H2201"
"HB937","Virginia Resiliency Grant Program and Fund.","H0393","Franklin","","Committee Referral Pending","1/13/2026","","","","","","","","N","N","N","N","N","N","N","N","HB937","1/13/2026","","","","","","","","","","","H2201","","","","","1/13/2026","H2201"
"HB938","Self-reporting of PFAS manufacture and use for PFAS assessment; Department of Environmental Quality; industrial wastewater; publicly owned treatment works.","H0336","Clark","","Committee Referral Pending","1/13/2026","","","","","","","","N","N","N","N","N","N","N","N","HB938","1/13/2026","","","","","","","","","","","H2201","","","","","1/13/2026","H2201"
"HB939","Baccalaureate public institutions of higher education; Richard Bland College; boards of visitors; membership; student representative. ","H0393","Franklin","","Committee Referral Pending","1/13/2026","","","","","","","","N","N","N","N","N","N","N","N","HB939","1/13/2026","","","","","","","","","","","H2201","","","","","1/13/2026","H2201"
"HB940","Charter; City of Suffolk.","H0336","Clark","","Committee Referral Pending","1/13/2026","","","","","","","","N","N","N","N","N","N","N","N","HB940","1/13/2026","","","","","","","","","","","H2201","","","","","1/13/2026","H2201"
"HB941","High school graduation requirements; hands-on bleeding control training.","H0336","Clark","","Committee Referral Pending","1/13/2026","","","","","","","","N","N","N","N","N","N","N","N","HB941","1/13/2026","","","","","","","","","","","H2201","","","","","1/13/2026","H2201"
"HB942","Child abuse and neglect; custody and visitation; possession or consumption of authorized substances.","H0336","Clark","","Committee Referral Pending","1/13/2026","","","","","","","","N","N","N","N","N","N","N","N","HB942","1/13/2026","","","","","","","","","","","H2201","","","","","1/13/2026","H2201"
"HB943","Free use of toll facilities; campus police officers.","H0393","Franklin","","Committee Referral Pending","1/13/2026","","","","","","","","N","N","N","N","N","N","N","N","HB943","1/13/2026","","","","","","","","","","","H2201","","","","","1/13/2026","H2201"
"HB944","Workplace violence policy required for certain employers; civil penalty.","H0336","Clark","","Committee Referral Pending","1/13/2026","","","","","","","","N","N","N","N","N","N","N","N","HB944","1/13/2026","","","","","","","","","","","H2201","","","","","1/13/2026","H2201"
"HB945","Department of Energy to study geothermal energy; State Corporation Commission proceeding to establish geothermal energy requirements for high energy users. ","H0336","Clark","","Committee Referral Pending","1/13/2026","","","","","","","","N","N","N","N","N","N","N","N","HB945","1/13/2026","","","","","","","","","","","H2201","","","","","1/13/2026","H2201"
"HB946","Income tax credit; affordable rental housing tax credit.","H0393","Franklin","","Committee Referral Pending","1/13/2026","","","","","","","","N","N","N","N","N","N","N","N","HB946","1/13/2026","","","","","","","","","","","H2201","","","","","1/13/2026","H2201"
"HB947","Virginia Youth Empowerment and Mentoring Grant Fund and Program; established. ","H0311","Askew","","Committee Referral Pending","1/13/2026","","","","","","","","N","N","N","N","N","N","N","N","HB947","1/13/2026","","","","","","","","","","","H2201","","","","","1/13/2026","H2201"
"HB948","Virginia Minimum Wage Act; enforcement; penalties. ","H0340","Maldonado","","Fiscal Impact statement From VCSC (1/14/2026 6:21 pm)","1/14/2026","","","","","","","","N","N","N","N","N","N","N","N","HB948","1/13/2026","","","","","","","","","","","H8500","","","","","1/13/2026","H2201"
"HB949","Covenants not to compete; exceptions; civil penalty. ","H0239","Lopez","","Committee Referral Pending","1/13/2026","","","","","","","","N","N","N","N","N","N","N","N","HB949","1/13/2026","","","","","","","","","","","H2201","","","","","1/13/2026","H2201"
"HB950","Use of unmanned aircraft systems by public bodies; search warrant required; exceptions.","H0239","Lopez","","Committee Referral Pending","1/13/2026","","","","","","","","N","N","N","N","N","N","N","N","HB950","1/13/2026","","","","","","","","","","","H2201","","","","","1/13/2026","H2201"
"HB951","Board of Housing and Community Development; ad hoc committees.","H0239","Lopez","","Committee Referral Pending","1/13/2026","","","","","","","","N","N","N","N","N","N","N","N","HB951","1/13/2026","","","","","","","","","","","H2201","","","","","1/13/2026","H2201"
"HB952","Chesapeake Bay Watershed Nutrient Credit Exchange Program; nutrient credit use by regulated entities.","H0239","Lopez","","Committee Referral Pending","1/13/2026","","","","","","","","N","N","N","N","N","N","N","N","HB952","1/13/2026","","","","","","","","","","","H2201","","","","","1/13/2026","H2201"
"HB953","Department of Housing and Community Development;","H0297","Guzman","","Committee Referral Pending","1/13/2026","","","","","","","","N","N","N","N","N","N","N","N","HB953","1/13/2026","","","","","","","","","","","H2201","","","","","1/13/2026","H2201"
"HB954","Local taxes; account balances and other charges; rounding procedures.","H0108","Watts","","Committee Referral Pending","1/13/2026","","","","","","","","N","N","N","N","N","N","N","N","HB954","1/13/2026","","","","","","","","","","","H2201","","","","","1/13/2026","H2201"
"HB955","State Council of Higher Education for Virginia; public institutions of higher education; certain annual student demographic data. ","H0297","Guzman","","Committee Referral Pending","1/13/2026","","","","","","","","N","N","N","N","N","N","N","N","HB955","1/13/2026","","","","","","","","","","","H2201","","","","","1/13/2026","H2201"
"HB956","License taxes; deduction for out-of-state receipts.","H0108","Watts","","Committee Referral Pending","1/13/2026","","","","","","","","N","N","N","N","N","N","N","N","HB956","1/13/2026","","","","","","","","","","","H2201","","","","","1/13/2026","H2201"
"HB957","Department of Education; anonymous student bullying tip line established.","H0297","Guzman","","Committee Referral Pending","1/13/2026","","","","","","","","N","N","N","N","N","N","N","N","HB957","1/13/2026","","","","","","","","","","","H2201","","","","","1/13/2026","H2201"
"HB958","Corporate income tax; taxable income; net operating loss. ","H0108","Watts","","Committee Referral Pending","1/13/2026","","","","","","","","N","N","N","N","N","N","N","N","HB958","1/13/2026","","","","","","","","","","","H2201","","","","","1/13/2026","H2201"
"HB959","Taxable income; subtractions; retirement income of certain federal employees.","H0108","Watts","","Committee Referral Pending","1/13/2026","","","","","","","","N","N","N","N","N","N","N","N","HB959","1/13/2026","","","","","","","","","","","H2201","","","","","1/13/2026","H2201"
"HB960","Personal property taxes; valuation.","H0108","Watts","","Committee Referral Pending","1/13/2026","","","","","","","","N","N","N","N","N","N","N","N","HB960","1/13/2026","","","","","","","","","","","H2201","","","","","1/13/2026","H2201"
"HB961","Retail sales and use tax; commercial and industrial exemptions; data centers.","H0108","Watts","","Committee Referral Pending","1/13/2026","","","","","","","","N","N","N","N","N","N","N","N","HB961","1/13/2026","","","","","","","","","","","H2201","","","","","1/13/2026","H2201"
"HB962","Labor and employment; nondiscrimination; prohibiting employer seeking wage or salary history of prospective employees; wage or salary range transparency; predictive scheduling for large employers; causes of action; civil penalties.","H0396","Mehta","","Committee Referral Pending","1/13/2026","","","","","","","","N","N","N","N","N","N","N","N","HB962","1/13/2026","","","","","","","","","","","H2201","","","","","1/13/2026","H2201"
"HB963","Constitutional amendment (voter referendum); qualifications of voters; right to vote; persons not entitled to vote.","H0284","Price","","Committee Referral Pending","1/13/2026","","","","","","","","N","N","N","N","N","N","N","N","HB963","1/13/2026","","","","","","","","","","","H2201","","","","","1/13/2026","H2201"
"HB964","Voter registration; restoration of political rights upon release from incarceration.","H0284","Price","","Committee Referral Pending","1/13/2026","","","","","","","","N","N","N","N","N","N","N","N","HB964","1/13/2026","","","","","","","","","","","H2201","","","","","1/13/2026","H2201"
"HB965","Presidential electors; National Popular Vote Compact.","H0284","Price","","Committee Referral Pending","1/13/2026","","","","","","","","N","N","N","N","N","N","N","N","HB965","1/13/2026","","","","","","","","","","","H2201","","","","","1/13/2026","H2201"
"HB966","Elections; duties of the Department of Elections; Systematic Alien Verification for Entitlements Program (SAVE Program). ","H0284","Price","","Committee Referral Pending","1/13/2026","","","","","","","","N","N","N","N","N","N","N","N","HB966","1/13/2026","","","","","","","","","","","H2201","","","","","1/13/2026","H2201"
"HB967","Elections; Voting Rights Act of Virginia. ","H0284","Price","","Committee Referral Pending","1/13/2026","","","","","","","","N","N","N","N","N","N","N","N","HB967","1/13/2026","","","","","","","","","","","H2201","","","","","1/13/2026","H2201"
"HB968","Election results; counting machine-readable ballots.","H0284","Price","","Committee Referral Pending","1/13/2026","","","","","","","","N","N","N","N","N","N","N","N","HB968","1/13/2026","","","","","","","","","","","H2201","","","","","1/13/2026","H2201"
"HB969","Virginia Gun Violence Prevention Center established. ","H0284","Price","","Committee Referral Pending","1/13/2026","","","","","","","","N","N","N","N","N","N","N","N","HB969","1/13/2026","","","","","","","","","","","H2201","","","","","1/13/2026","H2201"
"HB970","Preventative dental assistants; certification.","H0284","Price","","Committee Referral Pending","1/13/2026","","","","","","","","N","N","N","N","N","N","N","N","HB970","1/13/2026","","","","","","","","","","","H2201","","","","","1/13/2026","H2201"
"HB971","College student-athletes; biometric data; protections and limitations.","H0284","Price","","Committee Referral Pending","1/13/2026","","","","","","","","N","N","N","N","N","N","N","N","HB971","1/13/2026","","","","","","","","","","","H2201","","","","","1/13/2026","H2201"
"HB972","List maintenance omnibus","H0284","Price","","Committee Referral Pending","1/13/2026","","","","","","","","N","N","N","N","N","N","N","N","HB972","1/13/2026","","","","","","","","","","","H2201","","","","","1/13/2026","H2201"
"HB973","Health records; disclosure of laboratory test results; waiting period.","H0284","Price","","Committee Referral Pending","1/13/2026","","","","","","","","N","N","N","N","N","N","N","N","HB973","1/13/2026","","","","","","","","","","","H2201","","","","","1/13/2026","H2201"
"HB974","Witness impeachment evidence designation; review process.","H0284","Price","","Committee Referral Pending","1/13/2026","","","","","","","","N","N","N","N","N","N","N","N","HB974","1/13/2026","","","","","","","","","","","H2201","","","","","1/13/2026","H2201"
"HB975","Alcoholic beverage control; food-to-beverage ratio; report.","H0334","Bennett-Parker","","Committee Referral Pending","1/13/2026","","","","","","","","N","N","N","N","N","N","N","N","HB975","1/13/2026","","","","","","","","","","","H2201","","","","","1/13/2026","H2201"
"HB976","Transportation of person in the temporary detention process.","H0284","Price","","Committee Referral Pending","1/13/2026","","","","","","","","N","N","N","N","N","N","N","N","HB976","1/13/2026","","","","","","","","","","","H2201","","","","","1/13/2026","H2201"
"HB977","Conformity of the tax laws of the Commonwealth to the Internal Revenue Code. ","H0108","Watts","","House committee offered","1/16/2026","","","","","","","","Y","N","N","N","N","N","N","N","HB977","1/13/2026","","","","","","","","","","","H8122","","","","","1/13/2026","H8122"
"HB978","Taxation in the Commonwealth.","H0108","Watts","","Committee Referral Pending","1/13/2026","","","","","","","","N","N","N","N","N","N","N","N","HB978","1/13/2026","","","","","","","","","","","H2201","","","","","1/13/2026","H2201"
"HB979","Taxation provisions.","H0108","Watts","","Committee Referral Pending","1/13/2026","","","","","","","","N","N","N","N","N","N","N","N","HB979","1/13/2026","","","","","","","","","","","H2201","","","","","1/13/2026","H2201"
"HB980","Alcoholic beverage control; voluntary no-buy program; court-ordered inclusion on list of excluded persons. ","H0362","Garrett","","Committee Referral Pending","1/13/2026","","","","","","","","N","N","N","N","N","N","N","N","HB980","1/13/2026","","","","","","","","","","","H2201","","","","","1/13/2026","H2201"
"HB981","Criminal cases; prosecutorial misconduct; reasonable costs and attorney fees. ","H0362","Garrett","","Committee Referral Pending","1/13/2026","","","","","","","","N","N","N","N","N","N","N","N","HB981","1/13/2026","","","","","","","","","","","H2201","","","","","1/13/2026","H2201"
"HB982","Political campaign advertisements; synthetic media, penalty.","H0362","Garrett","","Committee Referral Pending","1/13/2026","","","","","","","","N","N","N","N","N","N","N","N","HB982","1/13/2026","","","","","","","","","","","H2201","","","","","1/13/2026","H2201"
"HB983","Immunization requirements for children; hepatitis B vaccine.","H0362","Garrett","","Committee Referral Pending","1/13/2026","","","","","","","","N","N","N","N","N","N","N","N","HB983","1/13/2026","","","","","","","","","","","H2201","","","","","1/13/2026","H2201"
"HB984","Virginia Consumer Protection Act; cash payments; discrimination prohibited; penalty.","H0362","Garrett","","Committee Referral Pending","1/13/2026","","","","","","","","N","N","N","N","N","N","N","N","HB984","1/13/2026","","","","","","","","","","","H2201","","","","","1/13/2026","H2201"
"HB985","Local land use; authority for decision belongs solely to locality. ","H0362","Garrett","","Committee Referral Pending","1/13/2026","","","","","","","","N","N","N","N","N","N","N","N","HB985","1/13/2026","","","","","","","","","","","H2201","","","","","1/13/2026","H2201"
