"Bill_id","Bill_description","Patron_id","Patron_name","Last_house_committee_id","Last_house_action","Last_house_action_date","Last_senate_committee_id","Last_senate_action","Last_senate_action_date","Last_conference_action","Last_conference_action_date","Last_governor_action","Last_governor_action_date","Emergency","Passed_house","Passed_senate","Passed","Failed","Carried_over","Approved","Vetoed","Full_text_doc1","Full_text_date1","Full_text_doc2","Full_text_date2","Full_text_doc3","Full_text_date3","Full_text_doc4","Full_text_date4","Full_text_doc5","Full_text_date5","Full_text_doc6","Full_text_date6","Last_house_actid","Last_senate_actid","Last_conference_actid","Last_governor_actid","Chapter_id","Introduction_date","Last_actid"
"HB486","Medical care facilities; expanded access to medical cannabis for terminally ill patients.","H0344","Shin","H24","Referred to Committee on Health and Human Services","1/12/2026","","","","","","","","N","N","N","N","N","N","N","N","HB486","1/12/2026","","","","","","","","","","","H2401","","","","","1/12/2026","H2401"
"HB487","State-owned bottomlands; localities, property interest.","H0366","Hernandez","H01","Referred to Committee on Agriculture, Chesapeake and Natural Resources","1/12/2026","","","","","","","","N","N","N","N","N","N","N","N","HB487","1/12/2026","","","","","","","","","","","H0101","","","","","1/12/2026","H0101"
"HB488","Wage garnishment; state tax debt.","H0366","Hernandez","H10","Referred to Committee on Finance","1/12/2026","","","","","","","","N","N","N","N","N","N","N","N","HB488","1/12/2026","","","","","","","","","","","H1001","","","","","1/12/2026","H1001"
"HB489","Restorative justice practice certain communications are not admissible to discovery and disclosure.","H0219","Hope","H08","Referred to Committee for Courts of Justice","1/12/2026","","","","","","","","N","N","N","N","N","N","N","N","HB489","1/12/2026","","","","","","","","","","","H0801","","","","","1/12/2026","H0801"
"HB490","Health insurance; coverage for early refills prescription eye drops.","H0219","Hope","H14","Referred to Committee on Labor and Commerce","1/12/2026","","","","","","","","N","N","N","N","N","N","N","N","HB490","1/12/2026","","","","","","","","","","","H1401","","","","","1/12/2026","H1401"
"HB491","Line of Duty Act; eligibility for sheriffs and deputy sheriffs.","H0297","Guzman","H02","Assigned HAPP sub: Compensation  and Retirement","1/17/2026","","","","","","","","N","N","N","N","N","N","N","N","HB491","1/12/2026","","","","","","","","","","","H0212","","","","","1/12/2026","H0212"
"HB492","Public utilities; vegetation management in public parks.","H0351","Seibold","H14","Referred to Committee on Labor and Commerce","1/12/2026","","","","","","","","N","N","N","N","N","N","N","N","HB492","1/12/2026","","","","","","","","","","","H1401","","","","","1/12/2026","H1401"
"HB493","Absentee voting; ballots received, marked, and cast electronically through the internet.","H0219","Hope","H18","Referred to Committee on Privileges and Elections","1/12/2026","","","","","","","","N","N","N","N","N","N","N","N","HB493","1/12/2026","","","","","","","","","","","H1801","","","","","1/12/2026","H1801"
"HB494","Virginia Personnel Act; hiring preference in state government, certain former federal employees.","H0297","Guzman","H11","Referred to Committee on General Laws","1/12/2026","","","","","","","","N","N","N","N","N","N","N","N","HB494","1/12/2026","","","","","","","","","","","H1101","","","","","1/12/2026","H1101"
"HB495","School boards; mental health awareness training, anonymous student reporting system.","H0297","Guzman","H09","Referred to Committee on Education","1/12/2026","","","","","","","","N","N","N","N","N","N","N","N","HB495","1/12/2026","","","","","","","","","","","H0901","","","","","1/12/2026","H0901"
"HB496","Siting of data centers; site assessment, water use disclosures.","H0297","Guzman","H07","Referred to Committee on Counties, Cities and Towns","1/12/2026","","","","","","","","N","N","N","N","N","N","N","N","HB496","1/12/2026","","","","","","","","","","","H0701","","","","","1/12/2026","H0701"
"HB497","Students with disabilities, certain; certain communication, reporting, and data posting.","H0297","Guzman","H09","Referred to Committee on Education","1/12/2026","","","","","","","","N","N","N","N","N","N","N","N","HB497","1/12/2026","","","","","","","","","","","H0901","","","","","1/12/2026","H0901"
"HB498","Motor carrier violations; authority of law-enforcement officers.","H0108","Watts","H19","Referred to Committee on Transportation","1/12/2026","","","","","","","","N","N","N","N","N","N","N","N","HB498","1/12/2026","","","","","","","","","","","H1901","","","","","1/12/2026","H1901"
"HB499","Reclaimed asphalt pavement; Dept. of Transportation, et al., to study using to maximize savings.","H0108","Watts","H20","Referred to Committee on Rules","1/12/2026","","","","","","","","N","N","N","N","N","N","N","N","HB499","1/12/2026","","","","","","","","","","","H2001","","","","","1/12/2026","H2001"
"HB500","State park; Dept. of Conservation & Recreation to acquire property to establish in Loudoun County.","H0395","McAuliff","H01","Referred to Committee on Agriculture, Chesapeake and Natural Resources","1/12/2026","","","","","","","","N","N","N","N","N","N","N","N","HB500","1/12/2026","","","","","","","","","","","H0101","","","","","1/12/2026","H0101"
"HB501","Groundwater supply in western Loudoun and Fauquier Counties; DEQ to study threats and challenges.","H0395","McAuliff","H20","Referred to Committee on Rules","1/12/2026","","","","","","","","N","N","N","N","N","N","N","N","HB501","1/12/2026","","","","","","","","","","","H2001","","","","","1/12/2026","H2001"
"HB502","Baccalaureate public institutions of higher education; fixed in-state tuition rates.","H0395","McAuliff","H09","Referred to Committee on Education","1/12/2026","","","","","","","","N","N","N","N","N","N","N","N","HB502","1/12/2026","","","","","","","","","","","H0901","","","","","1/12/2026","H0901"
"HB503","Electric utilities; cost recovery, costs substantially related to serving data center customers.","H0395","McAuliff","H14","Referred to Committee on Labor and Commerce","1/12/2026","","","","","","","","N","N","N","N","N","N","N","N","HB503","1/12/2026","","","","","","","","","","","H1401","","","","","1/12/2026","H1401"
"HB504","Income tax, state; tax credit for certain small businesses.","H0395","McAuliff","H10","Referred to Committee on Finance","1/12/2026","","","","","","","","N","N","N","N","N","N","N","N","HB504","1/12/2026","","","","","","","","","","","H1001","","","","","1/12/2026","H1001"
"HB505","Counties, cities, and towns; dual office holding, etc.","H0395","McAuliff","H18","Referred to Committee on Privileges and Elections","1/12/2026","","","","","","","","N","N","N","N","N","N","N","N","HB505","1/12/2026","","","","","","","","","","","H1801","","","","","1/12/2026","H1801"
"HB506","Animal slaughterhouse; VDACS, et al., additional slaughterhouse in Northern Virginia, report.","H0395","McAuliff","H20","Referred to Committee on Rules","1/12/2026","","","","","","","","N","N","N","N","N","N","N","N","HB506","1/12/2026","","","","","","","","","","","H2001","","","","","1/12/2026","H2001"
"HB507","Data center carbon dioxide-emitting backup generators; air monitoring.","H0395","McAuliff","H01","Referred to Committee on Agriculture, Chesapeake and Natural Resources","1/12/2026","","","","","","","","N","N","N","N","N","N","N","N","HB507","1/12/2026","","","","","","","","","","","H0101","","","","","1/12/2026","H0101"
"HB508","Small renewable energy projects; agrivoltaics definition, report.","H0395","McAuliff","H14","Referred to Committee on Labor and Commerce","1/12/2026","","","","","","","","N","N","N","N","N","N","N","N","HB508","1/12/2026","","","","","","","","","","","H1401","","","","","1/12/2026","H1401"
"HB509","Zoning; agricultural operations, rental of accessory dwellings.","H0395","McAuliff","H07","Referred to Committee on Counties, Cities and Towns","1/12/2026","","","","","","","","N","N","N","N","N","N","N","N","HB509","1/12/2026","","","","","","","","","","","H0701","","","","","1/12/2026","H0701"
"HB510","Uniform Power of Attorney Act; agent's duty of disclosure.","H0395","McAuliff","H08","Referred to Committee for Courts of Justice","1/12/2026","","","","","","","","N","N","N","N","N","N","N","N","HB510","1/12/2026","","","","","","","","","","","H0801","","","","","1/12/2026","H0801"
"HB511","Data centers; industrial zoning.","H0395","McAuliff","H07","Referred to Committee on Counties, Cities and Towns","1/12/2026","","","","","","","","N","N","N","N","N","N","N","N","HB511","1/12/2026","","","","","","","","","","","H0701","","","","","1/12/2026","H0701"
"HB512","Virginia Farm and Forest Prosperity Plan; OSAF to develop and implement comprehensive Plan, report.","H0399","Pope Adams","H01","Referred to Committee on Agriculture, Chesapeake and Natural Resources","1/13/2026","","","","","","","","N","N","N","N","N","N","N","N","HB512","1/13/2026","","","","","","","","","","","H0101","","","","","1/13/2026","H0101"
"HB513","Overdose fatality review teams; suicide deaths of veterans and military service members.","H0374","Martinez","H24","Referred to Committee on Health and Human Services","1/13/2026","","","","","","","","N","N","N","N","N","N","N","N","HB513","1/13/2026","","","","","","","","","","","H2401","","","","","1/13/2026","H2401"
"HB514","Benefit awareness & access prog.; establishes, military service members transition to civilian life.","H0374","Martinez","H11","Referred to Committee on General Laws","1/13/2026","","","","","","","","N","N","N","N","N","N","N","N","HB514","1/13/2026","","","","","","","","","","","H1101","","","","","1/13/2026","H1101"
"HB515","Sports betting; prohibition on use of credit cards.","H0374","Martinez","H11","Referred to Committee on General Laws","1/13/2026","","","","","","","","N","N","N","N","N","N","N","N","HB515","1/13/2026","","","","","","","","","","","H1101","","","","","1/13/2026","H1101"
"HB516","Health insurance; coverage for non-opioid prescription drugs.","H0374","Martinez","H14","Referred to Committee on Labor and Commerce","1/13/2026","","","","","","","","N","N","N","N","N","N","N","N","HB516","1/13/2026","","","","","","","","","","","H1401","","","","","1/13/2026","H1401"
"HB517","Driver communication improvement program; expands program, drivers with autism spectrum disorder.","H0374","Martinez","H19","Referred to Committee on Transportation","1/13/2026","","","","","","","","N","N","N","N","N","N","N","N","HB517","1/13/2026","","","","","","","","","","","H1901","","","","","1/13/2026","H1901"
"HB518","Virginia Consumer Protection Act; prohibited practices, streaming advertisement volume control.","H0374","Martinez","H11","Referred to Committee on General Laws","1/13/2026","","","","","","","","N","N","N","N","N","N","N","N","HB518","1/13/2026","","","","","","","","","","","H1101","","","","","1/13/2026","H1101"
"HB519","Virginia Residential Landlord and Tenant Act; essential services.","H0374","Martinez","H11","Referred to Committee on General Laws","1/13/2026","","","","","","","","N","N","N","N","N","N","N","N","HB519","1/13/2026","","","","","","","","","","","H1101","","","","","1/13/2026","H1101"
"HB520","Clerk fees; secure remote access to nonconfidential court records by certain attorneys.","H0366","Hernandez","H08","Referred to Committee for Courts of Justice","1/13/2026","","","","","","","","N","N","N","N","N","N","N","N","HB520","1/13/2026","","","","","","","","","","","H0801","","","","","1/13/2026","H0801"
"HB521","Marine Resources Commission; powers and duties, wetlands, report.","H0366","Hernandez","H01","Referred to Committee on Agriculture, Chesapeake and Natural Resources","1/13/2026","","","","","","","","N","N","N","N","N","N","N","N","HB521","1/13/2026","","","","","","","","","","","H0101","","","","","1/13/2026","H0101"
"HB522","Virginia Private College Preservation and Maintenance Fund and Program; established, report.","H0327","Willett","H02","Assigned HAPP sub: Higher Education","1/17/2026","","","","","","","","N","N","N","N","N","N","N","N","HB522","1/13/2026","","","","","","","","","","","H0212","","","","","1/13/2026","H0212"
"HB523","Military medical personnel; expands, program.","H0327","Willett","H24","Referred to Committee on Health and Human Services","1/13/2026","","","","","","","","N","N","N","N","N","N","N","N","HB523","1/13/2026","","","","","","","","","","","H2401","","","","","1/13/2026","H2401"
"HB524","Tourism improvement districts; transient occupancy tax in Arlington County.","H0375","McClure","H07","Fiscal Impact statement From TAX (1/17/2026 12:42 pm)","1/17/2026","","","","","","","","N","N","N","N","N","N","N","N","HB524","1/13/2026","","","","","","","","","","","H8500","","","","","1/13/2026","H0701"
"HB525","Family Access to Medical Insurance Security Plan; amends plan, literacy pilot program.","H0392","Downey","H24","Referred to Committee on Health and Human Services","1/13/2026","","","","","","","","N","N","N","N","N","N","N","N","HB525","1/13/2026","","","","","","","","","","","H2401","","","","","1/13/2026","H2401"
"HB526","Nationally Certified School Psychologist Program; established.","H0392","Downey","H02","Assigned HAPP sub: Elementary & Secondary Education","1/17/2026","","","","","","","","N","N","N","N","N","N","N","N","HB526","1/13/2026","","","","","","","","","","","H0212","","","","","1/13/2026","H0212"
"HB527","Eviction Reduction Program; established, report.","H0375","McClure","H11","Referred to Committee on General Laws","1/13/2026","","","","","","","","N","N","N","N","N","N","N","N","HB527","1/13/2026","","","","","","","","","","","H1101","","","","","1/13/2026","H1101"
"HB528","Compromise of claim for death by wrongful act; approval without a hearing.","H0400","Thornton","H08","Referred to Committee for Courts of Justice","1/13/2026","","","","","","","","N","N","N","N","N","N","N","N","HB528","1/13/2026","","","","","","","","","","","H0801","","","","","1/13/2026","H0801"
"HB529","Suicide Prevention Program; created, deaths by suicide of veterans or military service members.","H0400","Thornton","H24","Referred to Committee on Health and Human Services","1/13/2026","","","","","","","","N","N","N","N","N","N","N","N","HB529","1/13/2026","","","","","","","","","","","H2401","","","","","1/13/2026","H2401"
"HB530","Dentist and Dental Hygienist Compact; criminal background check.","H0400","Thornton","H24","Referred to Committee on Health and Human Services","1/13/2026","","","","","","","","N","N","N","N","N","N","N","N","HB530","1/13/2026","","","","","","","","","","","H2401","","","","","1/13/2026","H2401"
"HB531","Abortion; born alive infant, treatment and care, penalty.","H0394","Hamilton","H24","Fiscal Impact statement From VCSC (1/13/2026 1:17 pm)","1/13/2026","","","","","","","","N","N","N","N","N","N","N","N","HB531","1/13/2026","","","","","","","","","","","H8500","","","","","1/13/2026","H2401"
"HB532","Sage's Law; minor students experiencing gender incongruence, etc.","H0394","Hamilton","H09","Fiscal Impact Statement from Department of Planning and Budget (HB532)","1/15/2026","","","","","","","","N","N","N","N","N","N","N","N","HB532","1/13/2026","","","","","","","","","","","H8500","","","","","1/13/2026","H0901"
"HB533","Virginia National Guard; deployment to active duty combat.","H0394","Hamilton","H15","Referred to Committee on Public Safety","1/13/2026","","","","","","","","N","N","N","N","N","N","N","N","HB533","1/13/2026","","","","","","","","","","","H1501","","","","","1/13/2026","H1501"
"HB534","Students who receive home instruction; teacher evaluation letter of student academic progress.","H0394","Hamilton","H09","Fiscal Impact Statement from Department of Planning and Budget (HB534)","1/15/2026","","","","","","","","N","N","N","N","N","N","N","N","HB534","1/13/2026","","","","","","","","","","","H8500","","","","","1/13/2026","H0901"
"HB535","Review of plats and plans by locality; designated agent.","H0394","Hamilton","H07","Referred to Committee on Counties, Cities and Towns","1/13/2026","","","","","","","","N","N","N","N","N","N","N","N","HB535","1/13/2026","","","","","","","","","","","H0701","","","","","1/13/2026","H0701"
"HB536","Impact fees; locality authorized to impose on residential development.","H0394","Hamilton","H07","Referred to Committee on Counties, Cities and Towns","1/13/2026","","","","","","","","N","N","N","N","N","N","N","N","HB536","1/13/2026","","","","","","","","","","","H0701","","","","","1/13/2026","H0701"
"HB537","Regulations governing waterworks; prohibition on fluoridation of water.","H0394","Hamilton","H24","Fiscal Impact Statement from Department of Planning and Budget (HB537)","1/15/2026","","","","","","","","N","N","N","N","N","N","N","N","HB537","1/13/2026","","","","","","","","","","","H8500","","","","","1/13/2026","H2401"
"HB538","Statute of limitations; sexual abuse of a minor, act by a person of authority.","H0394","Hamilton","H08","Referred to Committee for Courts of Justice","1/13/2026","","","","","","","","N","N","N","N","N","N","N","N","HB538","1/13/2026","","","","","","","","","","","H0801","","","","","1/13/2026","H0801"
"HB539","Local highway system funding; revenue-sharing funds, funding cycle.","H0394","Hamilton","H19","Referred to Committee on Transportation","1/13/2026","","","","","","","","N","N","N","N","N","N","N","N","HB539","1/13/2026","","","","","","","","","","","H1901","","","","","1/13/2026","H1901"
"HB540","Carrying firearms in restricted locations; exception.","H0394","Hamilton","","Committee Referral Pending","1/13/2026","","","","","","","","N","N","N","N","N","N","N","N","HB540","1/13/2026","","","","","","","","","","","H2201","","","","","1/13/2026","H2201"
"HB541","Prospective school board employees and contractors; disqualification, conviction for certain crimes.","H0394","Hamilton","","Fiscal Impact Statement from Department of Planning and Budget (HB541)","1/15/2026","","","","","","","","N","N","N","N","N","N","N","N","HB541","1/13/2026","","","","","","","","","","","H8500","","","","","1/13/2026","H2201"
"HB542","Abortion; informed written consent, newborn safety devices.","H0394","Hamilton","","Committee Referral Pending","1/13/2026","","","","","","","","N","N","N","N","N","N","N","N","HB542","1/13/2026","","","","","","","","","","","H2201","","","","","1/13/2026","H2201"
"HB543","Forest Sustainability Fund; Office of Working Lands Preservation to manage.","H0387","Carnegie","","Committee Referral Pending","1/13/2026","","","","","","","","N","N","N","N","N","N","N","N","HB543","1/13/2026","","","","","","","","","","","H2201","","","","","1/13/2026","H2201"
"HB544","School Construction and Modernization, Commission on; revisions, elimination of sunset.","H0311","Askew","","Committee Referral Pending","1/13/2026","","","","","","","","N","N","N","N","N","N","N","N","HB544","1/13/2026","","","","","","","","","","","H2201","","","","","1/13/2026","H2201"
"HB545","Motorcycle Driver Improvement Clinic Fund; created.","H0308","McNamara","","Committee Referral Pending","1/13/2026","","","","","","","","N","N","N","N","N","N","N","N","HB545","1/13/2026","","","","","","","","","","","H2201","","","","","1/13/2026","H2201"
"HB546","Western Virginia Public Education Consortium; funding, duties.","H0308","McNamara","","Committee Referral Pending","1/13/2026","","","","","","","","N","N","N","N","N","N","N","N","HB546","1/13/2026","","","","","","","","","","","H2201","","","","","1/13/2026","H2201"
"HB547","Private companies providing public transportation services; employee protections.","H0317","Helmer","","Committee Referral Pending","1/13/2026","","","","","","","","N","N","N","N","N","N","N","N","HB547","1/13/2026","","","","","","","","","","","H2201","","","","","1/13/2026","H2201"
"HB548","Uniform Health Care Decisions Act; civil penalty.","H0219","Hope","","Fiscal Impact statement From VCSC (1/13/2026 1:31 pm)","1/13/2026","","","","","","","","N","N","N","N","N","N","N","N","HB548","1/13/2026","","","","","","","","","","","H8500","","","","","1/13/2026","H2201"
"HB549","Conservation and replacement of trees during development process.","H0219","Hope","","Committee Referral Pending","1/13/2026","","","","","","","","N","N","N","N","N","N","N","N","HB549","1/13/2026","","","","","","","","","","","H2201","","","","","1/13/2026","H2201"
"HB550","Admissions tax in counties; retail sales and use tax dedicated to promotion of tourism.","H0386","Anderson","","Committee Referral Pending","1/13/2026","","","","","","","","N","N","N","N","N","N","N","N","HB550","1/13/2026","","","","","","","","","","","H2201","","","","","1/13/2026","H2201"
"HB551","Nondegree workforce training programs; accreditation.","H0386","Anderson","","Committee Referral Pending","1/13/2026","","","","","","","","N","N","N","N","N","N","N","N","HB551","1/13/2026","","","","","","","","","","","H2201","","","","","1/13/2026","H2201"
"HB552","Williamsburg, City of; amending charter, change of municipal elections.","H0386","Anderson","","Committee Referral Pending","1/13/2026","","","","","","","","N","N","N","N","N","N","N","N","HB552","1/13/2026","","","","","","","","","","","H2201","","","","","1/13/2026","H2201"
"HB553","Corrections, Department of; language services for offenders.","H0386","Anderson","","Committee Referral Pending","1/13/2026","","","","","","","","N","N","N","N","N","N","N","N","HB553","1/13/2026","","","","","","","","","","","H2201","","","","","1/13/2026","H2201"
"HB554","State officers and employees; state agencies to establish alternative work schedules.","H0386","Anderson","","Committee Referral Pending","1/13/2026","","","","","","","","N","N","N","N","N","N","N","N","HB554","1/13/2026","","","","","","","","","","","H2201","","","","","1/13/2026","H2201"
"HB555","Signing of pleadings, etc., of a party represented by an attorney; attorney information required.","H0386","Anderson","","Committee Referral Pending","1/13/2026","","","","","","","","N","N","N","N","N","N","N","N","HB555","1/13/2026","","","","","","","","","","","H2201","","","","","1/13/2026","H2201"
"HB556","Marriage; final decree of divorce or annulment, necessary information.","H0380","Reaser","","Committee Referral Pending","1/13/2026","","","","","","","","N","N","N","N","N","N","N","N","HB556","1/13/2026","","","","","","","","","","","H2201","","","","","1/13/2026","H2201"
"HB557","Tangible personal property tax; establishes classification for electric landscaping equipment.","H0380","Reaser","","Committee Referral Pending","1/13/2026","","","","","","","","N","N","N","N","N","N","N","N","HB557","1/13/2026","","","","","","","","","","","H2201","","","","","1/13/2026","H2201"
"HB558","Drug Control Act; adds certain chemicals to Schedule I, penalties.","H0347","Wachsmann","","Fiscal Impact Statement from Department of Planning and Budget (HB558)","1/16/2026","","","","","","","","N","N","N","N","N","N","N","N","HB558","1/13/2026","","","","","","","","","","","H8500","","","","","1/13/2026","H2201"
"HB559","Driver training school and driver training instructors; standards, discipline, report.","H0328","Wyatt","","Committee Referral Pending","1/13/2026","","","","","","","","N","N","N","N","N","N","N","N","HB559","1/13/2026","","","","","","","","","","","H2201","","","","","1/13/2026","H2201"
"HB560","Administrative Process Act; appeals of case decisions regarding benefits sought.","H0219","Hope","","Committee Referral Pending","1/13/2026","","","","","","","","N","N","N","N","N","N","N","N","HB560","1/13/2026","","","","","","","","","","","H2201","","","","","1/13/2026","H2201"
"HB561","Driving while intoxicated; refusal of tests, repeat offenders, ignition interlocks.","H0219","Hope","","Committee Referral Pending","1/13/2026","","","","","","","","N","N","N","N","N","N","N","N","HB561","1/13/2026","","","","","","","","","","","H2201","","","","","1/13/2026","H2201"
"HB562","Electric cooperatives; authorized to establish and implement a virtual power plant program.","H0301","Reid","","Committee Referral Pending","1/13/2026","","","","","","","","N","N","N","N","N","N","N","N","HB562","1/13/2026","","","","","","","","","","","H2201","","","","","1/13/2026","H2201"
"HB563","Personal property taxation; establishes classification for major energy consumer equipment upgrades.","H0301","Reid","","Committee Referral Pending","1/13/2026","","","","","","","","N","N","N","N","N","N","N","N","HB563","1/13/2026","","","","","","","","","","","H2201","","","","","1/13/2026","H2201"
"HB564","Bus obstruction monitoring systems; parking, stopping and standing enforcement.","H0301","Reid","","Committee Referral Pending","1/13/2026","","","","","","","","N","N","N","N","N","N","N","N","HB564","1/13/2026","","","","","","","","","","","H2201","","","","","1/13/2026","H2201"
"HB565","Electric utilities; renewable portfolio standard program, zero-carbon electricity, etc.","H0301","Reid","","Committee Referral Pending","1/13/2026","","","","","","","","N","N","N","N","N","N","N","N","HB565","1/13/2026","","","","","","","","","","","H2201","","","","","1/13/2026","H2201"
"HB566","Tangible personal property tax relief; rate of taxation.","H0308","McNamara","","Committee Referral Pending","1/13/2026","","","","","","","","N","N","N","N","N","N","N","N","HB566","1/13/2026","","","","","","","","","","","H2201","","","","","1/13/2026","H2201"
"HB567","Court records; aggregated case data, request by attorney for the Commonwealth exempted.","H0387","Carnegie","","Committee Referral Pending","1/13/2026","","","","","","","","N","N","N","N","N","N","N","N","HB567","1/13/2026","","","","","","","","","","","H2201","","","","","1/13/2026","H2201"
